01/01/2025,"Ano Novo",NACIONAL,"O Ano-Novo ou Réveillon é um evento que acontece quando uma cultura celebra o fim de um ano e o começo do próximo. A celebração do evento é também chamada Réveillon, termo oriundo do verbo francês réveiller, que em português significa DESPERTAR",, 
18/04/2025,"Sexta-Feira Santa",NACIONAL,"Também chamada de ""Sexta Feira da Paixão"" é a sexta-feira que ocorre antes do domingo de Páscoa, e é o dia que os cristãos lembram da crucificação de Cristo.",, 
21/04/2025,"Dia de Tiradentes",NACIONAL,"Joaquim José da Silva Xavier, o Tiradentes foi um dentista, tropeiro, minerador, comerciante, militar e ativista político. É reconhecido como mártir da Inconfidência Mineira e herói nacional. O dia de sua execução, 21 de abril, é feriado nacional.",, 
01/05/2025,"Dia do Trabalho",NACIONAL,"O Dia do Trabalhador ou Dia Internacional dos Trabalhadores é celebrado anualmente no dia 1º de Maio em numerosos países do mundo, sendo feriado no Brasil, em Portugal e em outros países.",, 
07/09/2025,"Independência do Brasil",NACIONAL,"O Dia da Indepência do Brasil, oficialmente a data comemorada é a de 7 de setembro de 1822, em que ocorreu o chamado ""Grito do Ipiranga"".",, 
12/10/2025,"Nossa Senhora Aparecida",NACIONAL,"Nossa Senhora da Conceição Aparecida é a padroeira do Brasil. Sua festa é celebrada em 12 de outubro, um feriado nacional desde que o Papa João Paulo II consagrou a Basílica em 1980.",, 
02/11/2025,"Dia de Finados",NACIONAL,"O Dia de Finados ou Dia dos Fiéis Defuntos, (conhecido ainda como Dia dos Mortos no México), é celebrado pela Igreja Católica no dia 2 de novembro e é Feriado Nacional.",, 
15/11/2025,"Proclamação da República",NACIONAL,"A Proclamação da República foi um levante político-militar ocorrido em 15 de novembro de 1889 que instaurou a forma Republicana Federativa Presidencialista de governo no Brasil, derrubando a Monarquia e, por conseguinte, o imperador dom Pedro II.",, 
25/12/2025,"Natal",NACIONAL,"O Natal é comemorado anualmente em 25 de Dezembro. Originalmente destinado a celebrar o nascimento anual do Deus Sol no solstício de inverno, foi adaptado pela Igreja Católica no 3o século d.C., para permitir a conversão dos povos pagãos sob o domínio do Império Romano, passando a comemorar o nascimento de Jesus de Nazaré.",, 
